"session","created","modified","ended","expired","time13","yearOfBirth","gender","hispanic","ethnicity","people","employment_status","income","education","housing","own_rent","electric_bill","political_views","party","time14","feedback","time15","completionCode"
"lAviIZ5HEX2emD-KdEI9V35ZCyaQPr14-FsA-rSjO2Rspc6M0MqVN6i0pw6kJ6Mf","2024-07-09 02:52:47","2024-07-09 02:55:20","2024-07-09 02:55:20","","2024-07-09 02:52:47","1953","Male","No","White","2","Retired.","$100,000 to less than $125,000","College graduate/bachelor's degree/B.A./B.S.","Single family house not attached to any other house","1","$0 - $100","4","democratic","2024-07-09 02:54:26","","2024-07-09 02:54:59","634376"
"AQasrRqtczJd9opnD6T74YPKLLbfx6Djkpf34OYwlpHEP6vetO-z9yXW5uL74Jwm","2024-07-09 11:26:11","","","","2024-07-09 11:26:11","","","","","","","","","","","","","","","","",""
"Xf9g3WTsrwut_qjFh6SseAG6YxfwMnr6yeELlaO59xMTEOz51yjDVK_KLYh6aNB_","2024-07-10 14:53:29","2024-07-10 14:55:07","2024-07-10 14:55:07","","2024-07-10 14:53:29","1949","Male","No","White","1","Retired.","Prefer not to answer","M.B.A. or law degree","Single family house not attached to any other house","4","$300 - $400","2","independent","2024-07-10 14:54:48","","2024-07-10 14:54:55","977385"
"6M62zXCFGe9R7La8wzmCNgSeRtLNBxcRv3ZT6bnQrVlhOnmSWF5hq6ltQrUE_YnO","2024-07-11 00:56:44","2024-07-11 01:04:17","2024-07-11 01:04:18","","2024-07-11 00:56:45","1939","Male","No","White","2","Retired.","$30,000 to less than $40,000","Some college - two years or more/A.A. degree","Single family house not attached to any other house","2","$500 or more","3","republican","2024-07-11 00:59:34","Just hope I help just little. I've work in Quality all my life with some top companies in our great country. You never mention the word ""Quality"". So sad we see QC failing in everything.","2024-07-11 01:04:11","564866"
"WI8YU5mp5xvlyezsxBNapBqoeMVcfdELD8QUdgPNcx1TdqNeVuuhFIkYQkaidEhv","2024-07-11 03:15:33","2024-07-11 03:19:06","2024-07-11 03:19:06","","2024-07-11 03:15:33","1962","Male","No","White","1","Retired.","$15,000 to less than $30,000","Technical or trade school","Single family house not attached to any other house","1","$0 - $100","3","independent","2024-07-11 03:17:45","None ","2024-07-11 03:18:04","387273"
